,Section Names,Section Length,Chapter Links,Section Descriptions
381,Cloud Datalab の高度な分析情報,8,https://www.coursera.org/learn/gcp-advanced-insights-bigquery-jp,データ サイエンティスト ツールキットの主なツールである Cloud Datalab の紹介。アナリストはスケーラブルなクラウド ノートブックを使用して共同作業ができるようになります。
382,データアクセス,8,https://www.coursera.org/learn/gcp-advanced-insights-bigquery-jp,BigQuery データセットの保護と共有は、どの組織にとっても重要です。Google Cloud Platform と BigQuery ツールのうち、権限の管理とデータの共有に利用できるものについて学びます。
383,まとめ,8,https://www.coursera.org/learn/gcp-advanced-insights-bigquery-jp,お疲れさまでした。これで終了です。これまでに説明した内容をまとめてみましょう。
384,はじめに,6,https://www.coursera.org/learn/data-insights-gcp-apply-ml-jp,Data Insights 専門講座の最後のコースにご参加いただきありがとうございます。このモジュールでは、コースのトピックと、ラボで使用するプラットフォームの概要について確認します。
385,機械学習の概要,6,https://www.coursera.org/learn/data-insights-gcp-apply-ml-jp,このモジュールでは、機械学習について定義し、機械学習がどのようにビジネスにメリットをもたらすかについて説明します。機械学習を使用したデモをいくつか確認し、機械学習の主な用語（インスタンス、特徴、ラベルなど）について学習します。
386,事前トレーニング済み機械学習 API,6,https://www.coursera.org/learn/data-insights-gcp-apply-ml-jp,このモジュールでは、Cloud Datalab 内で利用できる事前に構築およびトレーニング済みの機械学習モデル（画像認識や感情分析など）について詳しく確認します。
387,BigQuery で機械学習データセットを作成する,6,https://www.coursera.org/learn/data-insights-gcp-apply-ml-jp,
388,BigQuery で機械学習モデルを作成する,6,https://www.coursera.org/learn/data-insights-gcp-apply-ml-jp,このモジュールでは、BigQuery 内で直接機械学習モデルを作成する方法を学習します。新しい構文を学習し、機械学習モデルの構築、評価、テストのフェーズを詳しく確認します。
389,コース終了にあたってのまとめ,6,https://www.coursera.org/learn/data-insights-gcp-apply-ml-jp,これで終了です。コースで学習した内容を復習し、学習を継続するために利用できるリソースを確認しましょう。
390,Introduction to Data Analytics,4,https://www.coursera.org/learn/decision-making?specialization=pwc-analytics,"In this module you'll learn the basics of data analytics and how businesses use to solve problems. You'll learn the value data analytics brings to business decision-making processes. We’ll introduce you to a framework for data analysis and tools used in data analytics. Finally, we’re going to talk about careers and roles in data analytics and data science."
391,Technology and types of data ,4,https://www.coursera.org/learn/decision-making?specialization=pwc-analytics,This module is an introductory look at big data and big data analytics where you will learn the about different types of data. We’ll also introduce you to PwC's perspective on big data and explain the impact of big data on businesses.  Finally we will name some of the different types of tools and technologies used to gather data.
392,Data analysis techniques and tools,4,https://www.coursera.org/learn/decision-making?specialization=pwc-analytics,In this module we will describe some of the tools for data analytics and some of the key technologies for data analysis. We will talk about how visualization is important to the practice of data analytics. Finally we will identify a variety of tools and languages used and consider when those tools are best used.
393,Data-driven decision making project ,4,https://www.coursera.org/learn/decision-making?specialization=pwc-analytics,"The course project will give you an opportunity to practice what you have learned.  You will participate in a simulated business situation in which you will select the best course of action.  You will then prepare a final deliverable which will be evaluated by your peers.  Additionally, you will have the opportunity to provide feedback on your peer's submissions.  "
394,Overview of Excel,4,https://www.coursera.org/learn/excel-analysis?specialization=pwc-analytics,"In this module, you will learn the basics of Excel navigation and Excel basic functionality. You will learn how to navigate the basic Excel screen including using formulas, subtotals and text formatting. We will provide you an opportunity to perform a problem solving exercise using basic Excel skills. Note: We recommend viewing videos in full-screen mode by clicking the double arrow in the lower right hand corner of your screen."
395,vLookups and Data Cleansing,4,https://www.coursera.org/learn/excel-analysis?specialization=pwc-analytics,"In this module you will learn about VLookup, value cleansing and text functions. We will also introduce you to PwC's perspective on the value in cleansing data and using the appropriate functions.  Finally, we will provide you an opportunity to perform a problem solving exercise using VLookup, value cleansing and text function. Note: We recommend viewing videos in full-screen mode by clicking the double arrow in the lower right hand corner of your screen."
396,Logical Functions & Pivot Tables,4,https://www.coursera.org/learn/excel-analysis?specialization=pwc-analytics,"In this module, you will learn about logical functions and pivot tables. We will show you how to create and use pivot tables to solve business problems. We will give you an opportunity to practice creating and using a pivot table to solve a business problem. Finally, we will share some insight on PwC’s perspectives on the impact of Excel on your career and work. Note: We recommend viewing videos in full-screen mode by clicking the double arrow in the lower right hand corner of your screen."
397,More Advanced Formulas,4,https://www.coursera.org/learn/excel-analysis?specialization=pwc-analytics,"In this module you will learn more advanced Excel formulas. We will show you how to create statistical formulas, perform an index match, and lastly, build financial formulas. We will provide you with an opportunity to problem solve using statistical formulas. Finally, we will give you an opportunity to practice what you have learned through a final project. Note: We recommend viewing videos in full-screen mode by clicking the double arrow in the lower right hand corner of your screen."
398,Preparing a Professional Excel ,4,https://www.coursera.org/learn/advanced-excel?specialization=pwc-analytics,"During this first week, you are going to learn about the development of data models and databases.  We will cover the components of data sets and the relational database models, database keys, relationships, and joins.  We will also look at a tool called PowerPivot that is used to import and prepare data to build relational models, as well as visualize data.  By the end of the week, you will have a working knowledge of how to develop a data model. Be sure to complete lessons in the order in which they are sequenced in the course."
399,Advanced Scenario Analysis ,4,https://www.coursera.org/learn/advanced-excel?specialization=pwc-analytics,"This week, we are going to explore three different analytical methods used to help model different scenarios and deal with variable uncertainty. These methods are scenario analysis, sensitivity analysis and simulation.  We’ll look at what each method is and then go deeper into why and how you use each.  Following some guided demonstration, you’ll be given a chance to practice in an Excel workbook and demonstrate what you’ve learned. "
400,Data Visualization,4,https://www.coursera.org/learn/advanced-excel?specialization=pwc-analytics,"This week we are going to focus on data visualization. We will start off by discussing data visualization basics, outlining the theory and concepts behind data visualization. We will also discuss how to enable effective story telling through the correct selection, creation, and presentation of tables and charts. You’ll get a chance to learn how to create detailed graphs and charts to effectively tell a story about your data. "
401,Dashboarding ,4,https://www.coursera.org/learn/advanced-excel?specialization=pwc-analytics,"In the final week of this course, you are going to learn how to create a dynamic dashboard. We are going to discuss how to establish a good understanding of your audience and how to collect key requirements in order to determine what type of dashboard to build.  We will talk about some guiding design principles and things to consider when building a dashboard. You’ll have a chance to practice everything you learn this week by creating your own functional dashboard in Excel.  "
402,Preparing a Presentation,4,https://www.coursera.org/learn/powerpoint-presentations?specialization=pwc-analytics,"This course is about presenting the story of the data, using PowerPoint. You'll learn how to structure a presentation and how to include insights and supporting data. You'll also learn some design principles for creating effective PowerPoint slides with visuals displaying data. Though application based exercises, you'll gain foundational communication skills - including public speaking, professional presence and compelling storytelling. Finally, you'll be given a client profile, a business problem, and a set of basic Excel charts, that you will use to create  a presentation.  You’ll receive peer feedback that you can use to enhance future presentations. This course was created by PricewaterhouseCoopers LLP with an address at 300 Madison Avenue, New York, New York, 10017"
403,Communication styles,4,https://www.coursera.org/learn/powerpoint-presentations?specialization=pwc-analytics,"This week, we will be covering the different types of communications styles.  You’ll start off by gaining an understanding of your personal professional presence and learn how to maximize it.  You’ll learn about verbal and nonverbal communications, and strategies to enhance your questioning and listening skills. We will also discuss how differences in culture can impact how you communicate."
404,Creating effective slides using PowerPoint,4,https://www.coursera.org/learn/powerpoint-presentations?specialization=pwc-analytics,"This week, we're discussing how to create effective slides using PowerPoint. You’ll learn about the tools available within PowerPoint, how to structure your storyline, create storyboards, identify primary elements of slide design, display data and finalize your slide presentation. There is a peer review activity where you will apply the skills learned and create a storyboard. Finally, you will also get a chance to identify errors in a presentation to test your knowledge of standard industry practices."
405,Delivering a presentation,4,https://www.coursera.org/learn/powerpoint-presentations?specialization=pwc-analytics,"This week, you’re going to build and deliver a presentation to your peers, and receive feedback from them.  You will create a presentation of about 10 slides, employing the guidelines and industry best practices that have been discussed in this course. You can use the presentation storyboard that you created last week, which your peers have reviewed and given you feedback on.  Review what you’ve developed so far, and make changes or additions that you think will enhance the presentation. Once you’ve finalized your presentation, you will present it in a video using your smartphone or computer.Once you’re satisfied with the PowerPoint presentation and video, you will be submitting both for peer review.  You can use this feedback for current and future presentations that you will make during your career."
406,Chapter One - Why we Program?,7,https://www.coursera.org/learn/python?specialization=python,These are the course-wide materials as well as the first part of Chapter One where we explore what it means to write programs.  We finish Chapter One and have the quiz and first assignment in the third week of the class. Throughout the course you may want to come back and look at these materials.  This section should not take you an entire week. 
407,Installing and Using Python,7,https://www.coursera.org/learn/python?specialization=python,"In this module you will set things up so you can write Python programs.  Not all activities in this module are required for this class so please read the ""Using Python in this Class"" material for details."
408,Chapter One: Why We Program (continued),7,https://www.coursera.org/learn/python?specialization=python,"In the first chapter we try to cover the ""big picture"" of programming so you get a ""table of contents"" of the rest of the book.   Don't worry if not everything makes perfect sense the first time you hear it.   This chapter is quite broad and you would benefit from reading the chapter in the book in addition to watching the lectures to help it all sink in.  You might want to come back and re-watch these lectures after you have funished a few more chapters."
409,Chapter Two: Variables and Expressions,7,https://www.coursera.org/learn/python?specialization=python,"In this chapter we cover how a program uses the computer's memory to store, retrieve and calculate information."
410,Chapter Three: Conditional Code,7,https://www.coursera.org/learn/python?specialization=python,"In this section we move from sequential code that simply runs one line of code after another to conditional code where some steps are skipped.  It is a very simple concept - but it is how computer software makes ""choices""."
411,Chapter Four: Functions,7,https://www.coursera.org/learn/python?specialization=python,"This is a relatively short chapter.   We will learn about what functions are and how we can use them.   The programs in the first chapters of the book are not large enough to require us to develop functions, but as the book moves into more and more complex programs, functions will be an essential way for us to make sense of our code."
412,Chapter Five: Loops and Iteration,7,https://www.coursera.org/learn/python?specialization=python,Loops and iteration complete our four basic programming patterns.  Loops are the way we tell Python to do something over and over.   Loops are the way we build programs that stay with a problem until the problem is solved.
413,Chapter Six: Strings,7,https://www.coursera.org/learn/python-data?specialization=python,"In this class, we pick up where we left off in the previous class, starting in Chapter 6 of the textbook and covering Strings and moving into data structures.   The second week of this class is dedicated to getting Python installed if you want to actually run the applications on your desktop or laptop.  If you choose not to install Python, you can just skip to the third week and get a head start."
414,Unit: Installing and Using Python,7,https://www.coursera.org/learn/python-data?specialization=python,"In this module you will set things up so you can write Python programs.  We do not require installation of Python for this class.  You can write and test Python programs in the browser using the ""Python Code Playground"" in this lesson.  Please read the ""Using Python in this Class"" material for details."
415,Chapter Seven: Files,7,https://www.coursera.org/learn/python-data?specialization=python,"Up to now, we have been working with data that is read from the user or data in constants.   But real programs process much larger amounts of data by reading and writing files on the secondary storage on your computer.   In this chapter we start to write our first programs that read, scan, and process real data.  "
416,Chapter Eight: Lists,7,https://www.coursera.org/learn/python-data?specialization=python,"As we want to solve more complex problems in Python, we need more powerful variables.  Up to now we have been using simple variables to store numbers or strings where we have a single value in a variable.  Starting with lists we will store many values in a single variable using an indexing scheme to store, organize, and retrieve different values from within a single variable.  We call these multi-valued variables ""collections"" or ""data structures""."
417,Chapter Nine: Dictionaries,7,https://www.coursera.org/learn/python-data?specialization=python,"The Python dictionary is one of its most powerful data structures.  Instead of representing values in a linear list, dictionaries store data as key / value pairs.  Using key / value pairs gives us a simple in-memory ""database"" in a single Python variable."
418,Chapter Ten: Tuples,7,https://www.coursera.org/learn/python-data?specialization=python,Tuples are our third and final basic Python data structure.  Tuples are a simple version of lists.  We often use tuples in conjunction with dictionaries to accomplish multi-step tasks like sorting or looping through all of the data in a dictionary.
419,Graduation,7,https://www.coursera.org/learn/python-data?specialization=python,"To celebrate your making it to the halfway point in our Python for Everybody Specialization, we welcome you to attend our online graduation ceremony.  It is not very long, and it features a Commencement speaker and very short commencement speech."
420,Getting Started,6,https://www.coursera.org/learn/python-network-data?specialization=python,"In this section you will install Python and a text editor.  In previous classes in the specialization this was an optional assignment, but in this class it is the first requirement to get started.  From this point forward we will stop using the browser-based Python grading environment because the browser-based Python environment (Skulpt) is not capable of running the more complex programs we will be developing in this class."
421,Regular Expressions (Chapter 11),6,https://www.coursera.org/learn/python-network-data?specialization=python,"Regular expressions are a very specialized language that allow us to succinctly search strings and extract data from strings.   Regular expressions are a language unto themselves.  It is not essential to know how to use regular expressions, but they can be quite useful and powerful."
422,Networks and Sockets (Chapter 12),6,https://www.coursera.org/learn/python-network-data?specialization=python,In this section we learn about the protocols that web browsers use to retrieve documents and web applications use to interact with Application Program Interfaces (APIs).
423,Programs that Surf the Web (Chapter 12),6,https://www.coursera.org/learn/python-network-data?specialization=python,In this section we learn to use Python to retrieve data from web sites and APIs over the Internet.
424,Web Services and XML (Chapter 13),6,https://www.coursera.org/learn/python-network-data?specialization=python,"In this section, we learn how to retrieve and parse XML (eXtensible Markup Language) data."
425,JSON and the REST Architecture (Chapter 13),6,https://www.coursera.org/learn/python-network-data?specialization=python,"In this module, we work with Application Program Interfaces / Web Services using the JavaScript Object Notation (JSON) data format."
426,Object Oriented Python,5,https://www.coursera.org/learn/python-databases?specialization=python,"To start this class out we cover the basics of Object Oriented Python. We won't be writing our own objects, but since many of the things we use like BeautifulSoup, strings, dictionaries, database connections all use Object Oriented (OO) patterns we should at least understand some of its patterns and terminology."
427,Basic Structured Query Language,5,https://www.coursera.org/learn/python-databases?specialization=python,"We learn the four core CRUD operations (Create, Read, Update, and Delete) to manage data stored in a database."
428,Data Models and Relational SQL,5,https://www.coursera.org/learn/python-databases?specialization=python,"In this section we learn about how data is stored across multiple tables in a database and how rows are linked (i.e., we establish relationships) in the database."
429,Many-to-Many Relationships in SQL,5,https://www.coursera.org/learn/python-databases?specialization=python,In this section we explore how to model situations like students enrolling in courses where each course has many students and each student is enrolled in many courses.
430,Databases and Visualization,5,https://www.coursera.org/learn/python-databases?specialization=python,"In this section, we put it all together, retrieve and process some data and then use the Google Maps API to visualize our data."
431,Welcome,5,https://www.coursera.org/learn/duke-programming-web?specialization=java-programming,"Welcome! In this module, you will be introduced to this course's approach to teaching the basics of programming, from building web pages, to writing programs with JavaScript, to making web pages interactive."
432,Designing a Web Page with HTML and CSS,5,https://www.coursera.org/learn/duke-programming-web?specialization=java-programming,"In this module, you will learn the basics of HTML and CSS to design a web page. Over the course of the module you will build your first web page!"
433,Algorithms and Programming Concepts,5,https://www.coursera.org/learn/duke-programming-web?specialization=java-programming,
434,JavaScript for Web Pages,5,https://www.coursera.org/learn/duke-programming-web?specialization=java-programming,
435,MiniProject: Image Filters on the Web,5,https://www.coursera.org/learn/duke-programming-web?specialization=java-programming,
436,Introduction to the Course,5,https://www.coursera.org/learn/java-programming?specialization=java-programming,"Welcome to “Java Programming: Solving Problems with Software”! We are excited that you are starting our course to learn how to write programs in Java, one of the most popular programming languages in the world. In this introductory module, you will get to meet the instructor team from Duke University and have an overview of the course. Have fun!"
437,Fundamental Java Syntax and Semantics,5,https://www.coursera.org/learn/java-programming?specialization=java-programming,"In this module, you will learn to write and run your first Java programs, including one program that prints “Hello!” in various countries’ languages and another where you will analyze the perimeters and other information of shapes. To accomplish these tasks, you will learn the basics of Java syntax and how to design stepwise solutions with programs. By the end of this module, you will be able to: (1) Download and run BlueJ, the Java programming environment for this course; (2) Access the documentation for the Java libraries specially designed for this course; (3) Edit, compile, and run a Java program; (4) Construct methods, variables, if else statements, and for each loops in Java; and (5) Use Iterables (like DirectoryResource) to run a program that iterates over multiples lines in a document or webpage or multiple files in a directory."
438,Strings in Java,5,https://www.coursera.org/learn/java-programming?specialization=java-programming,"This module begins with a short presentation from Raluca Gordân, an assistant professor in Duke University’s Center for Genomic and Computational Biology, about an important problem genomics scientists encounter regularly: how to identify genes in a strand of DNA. To tackle this problem, you will need to understand strings: series of characters such as letters, digits, punctuation, etc. After learning about Java methods that work with strings, you will be able to find genes within a DNA string as well as tackle other string related problems, such as finding all of the links in a web page. By the end of this module, you will be able to: (1) Use important methods for the Java String class; (2) Use conditionals, for loops, and while loops appropriately in a Java program; (3) Find patterns in the data represented by strings to help develop the algorithm for your program; (4) Understand the importance of designing programs that keep different data processing steps separate; (5) Use the StorageResource iterable for this course to store some data for further processing; and (6) Rely on Java documentation to better understand how to use different Java packages and classes."
439,CSV Files and Basic Statistics in Java,5,https://www.coursera.org/learn/java-programming?specialization=java-programming,"A common format for storing tabular data (any data organized into columns and rows) is in comma separated values (CSV) files. In this module, you will learn how to analyze and manipulate data from multiple CSV data files using a powerful open-source software package: Apache Commons CSV. Using this library will empower you to solve problems that could prove too complex to solve with a spreadsheet. By the end of this module, you will be able to: (1) Use the open-source Apache Commons CSV package in your own Java programs; (2) Access data from one or many CSV files using Java; (3) Convert strings into numbers; (4) Understand how to use “null” in Java programs (when you want to represent “nothing”); (5) Devise an algorithm (and implement in Java) to answer questions about CSV data; and (6) Analyze CSV data across multiple CSV files (for example, find maximums, minimums, averages, and other simple statistical results)."
