,Section Names,Section Length,Chapter Links,Section Descriptions
141,Variable Elimination,7,https://www.coursera.org/learn/probabilistic-graphical-models-2-inference,"This module presents the simplest algorithm for exact inference in graphical models: variable elimination. We describe the algorithm, and analyze its complexity in terms of properties of the graph structure."
142,Belief Propagation Algorithms ,7,https://www.coursera.org/learn/probabilistic-graphical-models-2-inference,This module describes an alternative view of exact inference in graphical models: that of message passing between clusters each of which encodes a factor over a subset of variables. This framework provides a basis for a variety of exact and approximate inference algorithms. We focus here on the basic framework and on its instantiation in the exact case of clique tree propagation. An optional lesson describes the loopy belief propagation (LBP) algorithm and its properties.
143,MAP Algorithms,7,https://www.coursera.org/learn/probabilistic-graphical-models-2-inference,"This module describes algorithms for finding the most likely assignment for a distribution encoded as a PGM (a task known as MAP inference). We describe message passing algorithms, which are very similar to the algorithms for computing conditional probabilities, except that we need to also consider how to decode the results to construct a single assignment. In an optional module, we describe a few other algorithms that are able to use very different techniques by exploiting the combinatorial optimization nature of the MAP task."
144,Sampling Methods,7,https://www.coursera.org/learn/probabilistic-graphical-models-2-inference,"In this module, we discuss a class of algorithms that uses random sampling to provide approximate answers to conditional probability queries. Most commonly used among these is the class of Markov Chain Monte Carlo (MCMC) algorithms, which includes the simple Gibbs sampling algorithm, as well as a family of methods known as Metropolis-Hastings."
145,Inference in Temporal Models,7,https://www.coursera.org/learn/probabilistic-graphical-models-2-inference,"In this brief lesson, we discuss some of the complexities of applying some of the exact or approximate inference algorithms that we learned earlier in this course to dynamic Bayesian networks."
146,Inference Summary,7,https://www.coursera.org/learn/probabilistic-graphical-models-2-inference,This module summarizes some of the topics that we covered in this course and discusses tradeoffs between different algorithms. It also includes the course final exam.
147,Learning: Overview,8,https://www.coursera.org/learn/probabilistic-graphical-models-3-learning,This module presents some of the learning tasks for probabilistic graphical models that we will tackle in this course.
148,Review of Machine Learning Concepts from Prof. Andrew Ng's Machine Learning Class (Optional),8,https://www.coursera.org/learn/probabilistic-graphical-models-3-learning,"This module contains some basic concepts from the general framework of machine learning, taken from Professor Andrew Ng's Stanford class offered on Coursera. Many of these concepts are highly relevant to the problems we'll tackle in this course."
149,Parameter Estimation in Bayesian Networks,8,https://www.coursera.org/learn/probabilistic-graphical-models-3-learning,"This module discusses the simples and most basic of the learning problems in probabilistic graphical models: that of parameter estimation in a Bayesian network. We discuss maximum likelihood estimation, and the issues with it. We then discuss Bayesian estimation and how it can ameliorate these problems."
150,Learning Undirected Models,8,https://www.coursera.org/learn/probabilistic-graphical-models-3-learning,"In this module, we discuss the parameter estimation problem for Markov networks - undirected graphical models. This task is considerably more complex, both conceptually and computationally, than parameter estimation for Bayesian networks, due to the issues presented by the global partition function."
151,Learning BN Structure,8,https://www.coursera.org/learn/probabilistic-graphical-models-3-learning,"This module discusses the problem of learning the structure of Bayesian networks. We first discuss how this problem can be formulated as an optimization problem over a space of graph structures, and what are good ways to score different structures so as to trade off fit to data and model complexity. We then talk about how the optimization problem can be solved: exactly in a few cases, approximately in most others."
152,Learning BNs with Incomplete Data,8,https://www.coursera.org/learn/probabilistic-graphical-models-3-learning,"In this module, we discuss the problem of learning models in cases where some of the variables in some of the data cases are not fully observed. We discuss why this situation is considerably more complex than the fully observable case. We then present the Expectation Maximization (EM) algorithm, which is used in a wide variety of problems."
153,Learning Summary and Final,8,https://www.coursera.org/learn/probabilistic-graphical-models-3-learning,This module summarizes some of the issues that arise when learning probabilistic graphical models from data. It also contains the course final.
154,PGM Wrapup,8,https://www.coursera.org/learn/probabilistic-graphical-models-3-learning,"This module contains an overview of PGM methods as a whole, discussing some of the real-world tradeoffs when using this framework in practice. It refers to topics from all three of the PGM courses."
155,Data Science Fundamentals,4,https://www.coursera.org/learn/data-scientists-tools?specialization=jhu-data-science,"In this module, we'll introduce and define data science and data itself. We'll also go over some of the resources that data scientists use to get help when they're stuck."
156,R and RStudio,4,https://www.coursera.org/learn/data-scientists-tools?specialization=jhu-data-science,"In this module, we'll help you get up and running with both R and RStudio. Along the way, you'll learn some basics about both and why data scientists use them. "
157,Version Control and GitHub,4,https://www.coursera.org/learn/data-scientists-tools?specialization=jhu-data-science,"During this module, you'll learn about version control and why it's so important to data scientists. You'll also learn how to use Git and GitHub to manage version control in data science projects."
158,"R Markdown, Scientific Thinking, and Big Data ",4,https://www.coursera.org/learn/data-scientists-tools?specialization=jhu-data-science,"During this final module, you'll learn to use R Markdown and get an introduction to three concepts that are incredibly important to every successful data scientist: asking good questions, experimental design, and big data. "
159,"Week 1: Background, Getting Started, and Nuts & Bolts",4,https://www.coursera.org/learn/r-programming?specialization=jhu-data-science,"This week covers the basics to get you started up with R. The Background Materials lesson contains information about course mechanics and some videos on installing R. The Week 1 videos cover the history of R and S, go over the basic data types in R, and describe the functions for reading and writing data. I recommend that you watch the videos in the listed order, but watching the videos out of order isn't going to ruin the story. "
160,Week 2: Programming with R,4,https://www.coursera.org/learn/r-programming?specialization=jhu-data-science,"Welcome to Week 2 of R Programming. This week, we take the gloves off, and the lectures cover key topics like control structures and functions. We also introduce the first programming assignment for the course, which is due at the end of the week."
161,Week 3: Loop Functions and Debugging,4,https://www.coursera.org/learn/r-programming?specialization=jhu-data-science,"We have now entered the third week of R Programming, which also marks the halfway point. The lectures this week cover loop functions and the debugging tools in R. These aspects of R make R useful for both interactive work and writing longer code, and so they are commonly used in practice."
162,Week 4: Simulation & Profiling,4,https://www.coursera.org/learn/r-programming?specialization=jhu-data-science,"This week covers how to simulate data in R, which serves as the basis for doing simulation studies. We also cover the profiler in R which lets you collect detailed information on how your R functions are running and to identify bottlenecks that can be addressed. The profiler is a key tool in helping you optimize your programs. Finally, we cover the str function, which I personally believe is the most useful function in R."
163,Week 1,4,https://www.coursera.org/learn/data-cleaning?specialization=jhu-data-science,"In this first week of the course, we look at finding data and reading different file types."
164,Week 2,4,https://www.coursera.org/learn/data-cleaning?specialization=jhu-data-science,Welcome to Week 2 of Getting and Cleaning Data! The primary goal is to introduce you to the most common data storage systems and the appropriate tools to extract data from web or from databases like MySQL. 
165,Week 3,4,https://www.coursera.org/learn/data-cleaning?specialization=jhu-data-science,"Welcome to Week 3 of Getting and Cleaning Data! This week the lectures will focus on organizing, merging and managing the data you have collected using the lectures from Weeks 1 and 2. "
166,Week 4,4,https://www.coursera.org/learn/data-cleaning?specialization=jhu-data-science,Welcome to Week 4 of Getting and Cleaning Data! This week we finish up with lectures on text and date manipulation in R. In this final week we will also focus on peer grading of Course Projects. 
167,Week 1,4,https://www.coursera.org/learn/exploratory-data-analysis?specialization=jhu-data-science,This week covers the basics of analytic graphics and the base plotting system in R. We've also included some background material to help you install R if you haven't done so already. 
168,Week 2,4,https://www.coursera.org/learn/exploratory-data-analysis?specialization=jhu-data-science,"Welcome to Week 2 of Exploratory Data Analysis. This week covers some of the more advanced graphing systems available in R: the Lattice system and the ggplot2 system. While the base graphics system provides many important tools for visualizing data, it was part of the original R system and lacks many features that may be desirable in a plotting system, particularly when visualizing high dimensional data. The Lattice and ggplot2 systems also simplify the laying out of plots making it a much less tedious process."
169,Week 3,4,https://www.coursera.org/learn/exploratory-data-analysis?specialization=jhu-data-science,Welcome to Week 3 of Exploratory Data Analysis. This week covers some of the workhorse statistical methods for exploratory analysis. These methods include clustering and dimension reduction techniques that allow you to make graphical displays of very high dimensional data (many many variables). We also cover novel ways to specify colors in R so that you can use color as an important and useful dimension when making data graphics. All of this material is covered in chapters 9-12 of my book Exploratory Data Analysis with R.
170,Week 4,4,https://www.coursera.org/learn/exploratory-data-analysis?specialization=jhu-data-science,"This week, we'll look at two case studies in exploratory data analysis. The first involves the use of cluster analysis techniques, and the second is a more involved analysis of some air pollution data. How one goes about doing EDA is often personal, but I'm providing these videos to give you a sense of how you might proceed with a specific type of dataset. "
171,Introduction to the Data and Machine Learning on Google Cloud Platform Specialization .,6,https://www.coursera.org/learn/gcp-big-data-ml-fundamentals?specialization=gcp-data-engineering,Welcome to the Big Data and Machine Learning fundamentals on GCP course. Here you will learn the basics of how the course is structured and the four main big data challenges you will solve for.
172,Recommending Products using Cloud SQL and Spark,6,https://www.coursera.org/learn/gcp-big-data-ml-fundamentals?specialization=gcp-data-engineering,In this module you will have an existing Apache SparkML recommendation model that is running on-premise. You will learn about recommendation models and how you can run them in the cloud with Cloud Dataproc and Cloud SQL.
173,Predict Visitor Purchases with BigQuery ML,6,https://www.coursera.org/learn/gcp-big-data-ml-fundamentals?specialization=gcp-data-engineering,"In this module, you will learn the foundations of BigQuery and big data analysis at scale. You will then learn how to build your own custom machine learning model to predict visitor purchases using just SQL with BigQuery ML. "
174,Create Streaming Data Pipelines with Cloud Pub/sub and Cloud Dataflow,6,https://www.coursera.org/learn/gcp-big-data-ml-fundamentals?specialization=gcp-data-engineering,"In this module you will engineer and build an auto-scaling streaming data pipeline to ingest, process, and visualize data on a dashboard. Before you build your pipeline you'll learn the foundations of message-oriented architecture and pitfalls to avoid when designing and implementing modern data pipelines."
175,Classify Images with Pre-Built Models using Vision API and Cloud AutoML,6,https://www.coursera.org/learn/gcp-big-data-ml-fundamentals?specialization=gcp-data-engineering,Don't want to create a custom ML model from scratch? Learn how to leverage and extend pre-built ML models like the Vision API and Cloud AutoML for image classification.
176,Summary,6,https://www.coursera.org/learn/gcp-big-data-ml-fundamentals?specialization=gcp-data-engineering,"In this final module, we will review the key challenges, solutions, and topics covered as part of this fundamentals course. We will also review additional resources and the steps you can take to get certified as a Google Cloud Data Engineer. "
177,Introduction,5,https://www.coursera.org/learn/data-lakes-data-warehouses-gcp?specialization=gcp-data-engineering,This module gives an introduction of the Data Engineering specialization and the course.
178,Introduction to Data Engineering,5,https://www.coursera.org/learn/data-lakes-data-warehouses-gcp?specialization=gcp-data-engineering,This module describes the role of a data engineer and motivates the claim why data engineering should be done in the Cloud
179,Building a Data Lake,5,https://www.coursera.org/learn/data-lakes-data-warehouses-gcp?specialization=gcp-data-engineering,"In this module, we describe what  data lake is and how to use Google Cloud Storage as you data lake on GCP"
180,Building a data warehouse,5,https://www.coursera.org/learn/data-lakes-data-warehouses-gcp?specialization=gcp-data-engineering,"In this module, we talk about BigQuery as a data warehousing option on GCP"
181,Summary,5,https://www.coursera.org/learn/data-lakes-data-warehouses-gcp?specialization=gcp-data-engineering,This module reviews all the topics covered in the course
182,Introduction,6,https://www.coursera.org/learn/batch-data-pipelines-gcp?specialization=gcp-data-engineering,"In this module, we introduce the course and agenda"
183,Introduction to Batch Data Pipelines,6,https://www.coursera.org/learn/batch-data-pipelines-gcp?specialization=gcp-data-engineering,"This module reviews different methods of data loading: EL, ELT and ETL and when to use what"
184,Executing Spark on Cloud Dataproc,6,https://www.coursera.org/learn/batch-data-pipelines-gcp?specialization=gcp-data-engineering,"This module shows how to run Hadoop on Cloud Dataproc, how to leverage GCS, and how to optimize your Dataproc jobs."
185,Manage Data Pipelines with Cloud Data Fusion and Cloud Composer	,6,https://www.coursera.org/learn/batch-data-pipelines-gcp?specialization=gcp-data-engineering,This module shows how to manage data pipelines with Cloud Data Fusion and Cloud Composer.  
186,Serverless Data Processing with Cloud Dataflow	,6,https://www.coursera.org/learn/batch-data-pipelines-gcp?specialization=gcp-data-engineering,This module covers using Cloud Dataflow to build your data processing pipelines
187,Summary,6,https://www.coursera.org/learn/batch-data-pipelines-gcp?specialization=gcp-data-engineering,This module reviews the topics covered in this course
188,Introduction,7,https://www.coursera.org/learn/streaming-analytics-systems-gcp?specialization=gcp-data-engineering,This module introduces the course and agenda
189,Introduction to Processing Streaming Data,7,https://www.coursera.org/learn/streaming-analytics-systems-gcp?specialization=gcp-data-engineering,This modules talks about challenges with processing streaming data
190,Serverless Messaging with Cloud Pub/Sub,7,https://www.coursera.org/learn/streaming-analytics-systems-gcp?specialization=gcp-data-engineering,This module talks about using Cloud Pub/Sub to ingest incoming streaming data
191,Cloud Dataflow Streaming Features,7,https://www.coursera.org/learn/streaming-analytics-systems-gcp?specialization=gcp-data-engineering,This module revisits Cloud Dataflow and focuses on its streaming data processing capabilities 
192,High-Throughput BigQuery and Bigtable Streaming Features,7,https://www.coursera.org/learn/streaming-analytics-systems-gcp?specialization=gcp-data-engineering,This modules covers BigQuery and Bigtable for streaming data
193,Advanced BigQuery Functionality and Performance,7,https://www.coursera.org/learn/streaming-analytics-systems-gcp?specialization=gcp-data-engineering,This module dives into more advanced features of BigQuery
194,Summary,7,https://www.coursera.org/learn/streaming-analytics-systems-gcp?specialization=gcp-data-engineering,This module recaps the topics covered in course
195,Introduction to the Data and Machine Learning on Google Cloud Platform Specialization .,6,https://www.coursera.org/learn/gcp-big-data-ml-fundamentals?specialization=gcp-data-machine-learning,Welcome to the Big Data and Machine Learning fundamentals on GCP course. Here you will learn the basics of how the course is structured and the four main big data challenges you will solve for.
196,Recommending Products using Cloud SQL and Spark,6,https://www.coursera.org/learn/gcp-big-data-ml-fundamentals?specialization=gcp-data-machine-learning,In this module you will have an existing Apache SparkML recommendation model that is running on-premise. You will learn about recommendation models and how you can run them in the cloud with Cloud Dataproc and Cloud SQL.
197,Predict Visitor Purchases with BigQuery ML,6,https://www.coursera.org/learn/gcp-big-data-ml-fundamentals?specialization=gcp-data-machine-learning,"In this module, you will learn the foundations of BigQuery and big data analysis at scale. You will then learn how to build your own custom machine learning model to predict visitor purchases using just SQL with BigQuery ML. "
198,Create Streaming Data Pipelines with Cloud Pub/sub and Cloud Dataflow,6,https://www.coursera.org/learn/gcp-big-data-ml-fundamentals?specialization=gcp-data-machine-learning,"In this module you will engineer and build an auto-scaling streaming data pipeline to ingest, process, and visualize data on a dashboard. Before you build your pipeline you'll learn the foundations of message-oriented architecture and pitfalls to avoid when designing and implementing modern data pipelines."
199,Classify Images with Pre-Built Models using Vision API and Cloud AutoML,6,https://www.coursera.org/learn/gcp-big-data-ml-fundamentals?specialization=gcp-data-machine-learning,Don't want to create a custom ML model from scratch? Learn how to leverage and extend pre-built ML models like the Vision API and Cloud AutoML for image classification.
200,Summary,6,https://www.coursera.org/learn/gcp-big-data-ml-fundamentals?specialization=gcp-data-machine-learning,"In this final module, we will review the key challenges, solutions, and topics covered as part of this fundamentals course. We will also review additional resources and the steps you can take to get certified as a Google Cloud Data Engineer. "
201,Introduction,5,https://www.coursera.org/learn/data-lakes-data-warehouses-gcp?specialization=gcp-data-machine-learning,This module gives an introduction of the Data Engineering specialization and the course.
202,Introduction to Data Engineering,5,https://www.coursera.org/learn/data-lakes-data-warehouses-gcp?specialization=gcp-data-machine-learning,This module describes the role of a data engineer and motivates the claim why data engineering should be done in the Cloud
203,Building a Data Lake,5,https://www.coursera.org/learn/data-lakes-data-warehouses-gcp?specialization=gcp-data-machine-learning,"In this module, we describe what  data lake is and how to use Google Cloud Storage as you data lake on GCP"
204,Building a data warehouse,5,https://www.coursera.org/learn/data-lakes-data-warehouses-gcp?specialization=gcp-data-machine-learning,"In this module, we talk about BigQuery as a data warehousing option on GCP"
205,Summary,5,https://www.coursera.org/learn/data-lakes-data-warehouses-gcp?specialization=gcp-data-machine-learning,This module reviews all the topics covered in the course
206,Introduction,6,https://www.coursera.org/learn/batch-data-pipelines-gcp?specialization=gcp-data-machine-learning,"In this module, we introduce the course and agenda"
207,Introduction to Batch Data Pipelines,6,https://www.coursera.org/learn/batch-data-pipelines-gcp?specialization=gcp-data-machine-learning,"This module reviews different methods of data loading: EL, ELT and ETL and when to use what"
208,Executing Spark on Cloud Dataproc,6,https://www.coursera.org/learn/batch-data-pipelines-gcp?specialization=gcp-data-machine-learning,"This module shows how to run Hadoop on Cloud Dataproc, how to leverage GCS, and how to optimize your Dataproc jobs."
209,Manage Data Pipelines with Cloud Data Fusion and Cloud Composer	,6,https://www.coursera.org/learn/batch-data-pipelines-gcp?specialization=gcp-data-machine-learning,This module shows how to manage data pipelines with Cloud Data Fusion and Cloud Composer.  
210,Serverless Data Processing with Cloud Dataflow	,6,https://www.coursera.org/learn/batch-data-pipelines-gcp?specialization=gcp-data-machine-learning,This module covers using Cloud Dataflow to build your data processing pipelines
211,Summary,6,https://www.coursera.org/learn/batch-data-pipelines-gcp?specialization=gcp-data-machine-learning,This module reviews the topics covered in this course
212,Introduction,7,https://www.coursera.org/learn/streaming-analytics-systems-gcp?specialization=gcp-data-machine-learning,This module introduces the course and agenda
213,Introduction to Processing Streaming Data,7,https://www.coursera.org/learn/streaming-analytics-systems-gcp?specialization=gcp-data-machine-learning,This modules talks about challenges with processing streaming data
214,Serverless Messaging with Cloud Pub/Sub,7,https://www.coursera.org/learn/streaming-analytics-systems-gcp?specialization=gcp-data-machine-learning,This module talks about using Cloud Pub/Sub to ingest incoming streaming data
215,Cloud Dataflow Streaming Features,7,https://www.coursera.org/learn/streaming-analytics-systems-gcp?specialization=gcp-data-machine-learning,This module revisits Cloud Dataflow and focuses on its streaming data processing capabilities 
216,High-Throughput BigQuery and Bigtable Streaming Features,7,https://www.coursera.org/learn/streaming-analytics-systems-gcp?specialization=gcp-data-machine-learning,This modules covers BigQuery and Bigtable for streaming data
217,Advanced BigQuery Functionality and Performance,7,https://www.coursera.org/learn/streaming-analytics-systems-gcp?specialization=gcp-data-machine-learning,This module dives into more advanced features of BigQuery
218,Summary,7,https://www.coursera.org/learn/streaming-analytics-systems-gcp?specialization=gcp-data-machine-learning,This module recaps the topics covered in course
219,What is AI? Applications and Examples of AI,4,https://www.coursera.org/learn/introduction-to-ai,"This week, you will learn what AI is. You will understand its applications and use cases and how it is transforming our lives. "
220,"AI Concepts, Terminology, and Application Areas",4,https://www.coursera.org/learn/introduction-to-ai,"This week, you will learn about basic AI concepts. You will understand how AI learns, and what some of its applications are."
221,"AI: Issues, Concerns and Ethical Considerations",4,https://www.coursera.org/learn/introduction-to-ai,"This week, you will learn about issues and concerns surrounding AI, including - ethical considerations, bias, jobs, etc. - their impact on society. This information will help you to have an informed discussion on the costs and benefits of AI, and reassure decision makers about implementing an AI solution."
222,"The Future with AI, and AI in Action",4,https://www.coursera.org/learn/introduction-to-ai,"This week, you will learn about the current thinking on the future with AI, as well as hear from experts about their advice to learn and start a career in AI. You will also demonstrate AI in action by utilizing Computer Vision to classify images. "
223,Watson AI Overview,4,https://www.coursera.org/learn/ai-with-ibm-watson,"This week, you will learn how Watson AI works. You will understand the many ways Watson AI is helping professionals and businesses reimagine their workflows, learn more from less data, and protect their insights. "
224,Watson AI Services,4,https://www.coursera.org/learn/ai-with-ibm-watson,"This week, you will learn about some of the Watson AI services offered on the IBM Cloud. You will understand how organizations can use Watson AI services and the types of situations in which each service applies."
