,Section Names,Section Length,Chapter Links,Section Descriptions
675,"Your Communication Toolbox: Visualizations, Logic, and Stories",6,https://www.coursera.org/learn/analytics-tableau?specialization=excel-mysql,"Welcome to week 4! This week you will become a master at getting people to agree with your data-driven business recommendations as you learn to deliver a compelling business presentation.  You’ll learn about the insight from the intersection of visualization science and decision science, and what this means for you as a  data analyst, who seeks to design a compelling and effective business presentations. If you intend to affect people’s decisions, you need to influence where they look. This week we will review  a set of tools and concepts you can use to optimize your visualizations and your presentation style. You will soon  be a master at getting people to agree with your data-driven business recommendations! <p>By the end of this week, you will be able to:<p><ul><li>Tell stories with data</li> <li>Design effective slide presentations to showcase your data story, and</li> <li> Deliver compelling business presentations</ul></li><p> Remember to refer back to the Study Guide: Designing and Delivering Effective Presentations. You will also complete a graded quiz. <p>As always, if you have any questions, post them to the <b>Discussions</b>.<p> To get started, please begin with the video “Using Visualization to Influence Business Decisions.”<p> I hope you enjoy this week's materials!"
676,Final Project,6,https://www.coursera.org/learn/analytics-tableau?specialization=excel-mysql,"Welcome to week 5! This week you will complete your final project. This assignment requires you to submit a recording of yourself giving a 4-5 minute presentation in which you present a data-driven business process change proposal to Dognition company management about how to increase the numbers of tests users complete. Students will give a short, peer-reviewed business presentation that uses a specified chart in Tableau. The final project will assess your mastery of the following: <p> <ul><li>Demonstrated understanding the Tableau functions discussed in this course</li><li>Adapting visualizations to make them maximally communicative</li><li>Storyboarding skills</li> <li>Translating your story into a presentation ready for the boardroom</li><li>Effective presentation delivery</li><li>Evaluating business presentations</ul></li><p> Remember to refer to the Background Information for Peer Review Assignment  on the course web site before you begin. This final course project is a comprehensive assessment covering all of the course material and will take approximately 6-8 hours to complete.<p>As always, if you have any questions, post them to the Discussions. Thank you for your contributions to this  final project!<p> "
677,About this Specialization and Course ,6,https://www.coursera.org/learn/analytics-mysql?specialization=excel-mysql,"The Coursera Specialization, ""Managing Big Data with MySQL"" is about how 'Big Data' interacts with business, and how to use data analytics to create value for businesses. This specialization consists of four courses and a final Capstone Project, where you will apply your skills to a real-world business process. You will learn to perform sophisticated data-analysis functions using powerful software tools such as Microsoft Excel, Tableau, and MySQL. To learn more about the specialization, please review the first lesson below, ""Specialization Introduction: Excel to MySQL: Analytic Techniques for Business.""  In this fourth course of this specialization, ""Managing Big Data with MySQL” you will learn how relational databases  work and how they are used in business analysis. Specifically, you will: (1) Describe the structure of relational databases; (2) Interpret and create entity-relationship diagrams and relational schemas that describe the contents of specific databases; (3) Write queries that retrieve and sort data that meet specific criteria, and retrieve such data from real MySQL and Teradata business databases that contain over 1 million rows of data; (4) Execute practices that limit the impact of your queries on other coworkers; (5) Summarize rows of data using aggregate functions, and segment aggregations according to specified variables; (6) Combine and manipulate data from multiple tables across a database; (7) Retrieve records and compute calculations that are dependent on dynamic data features; (8) Translate data analysis questions into SQL queries that accommodate the types of anomalies found in real data sets. By the end of this course, you will have a clear understanding of how relational databases work and have a portfolio of queries you can show potential employers. Businesses are collecting increasing amounts of information with the hope that data will yield novel insights into how to improve businesses.  Analysts that understand how to access this data – this means you! – will have a strong competitive advantage in this data-smitten business world.  To get started with this course, you can begin with, ""Introduction to Managing Big Data with MySQL.""  Please take some time to not only watch the videos, but also read through the course overview as there is extremely important course information in the overview.  "
678,Understanding Relational Databases,6,https://www.coursera.org/learn/analytics-mysql?specialization=excel-mysql,"Welcome to week 1! This week  you will learn how relational databases are organized, and practice making and interpreting Entity Relationship (ER) diagrams and relational schemas that describe the structure of data stored in a database. <p>By the end of the week, you will be able to:<ul><li>Describe the fundamental principles of relational database design <li>Interpret Entity Relationship (ER) diagrams and Entity Relationship (ER) schemas, and</li><li>Create your own ER diagrams and relational schemas using a software tool called ERDPlus that you will use to aid your query-writing later in the course.</li></ul><p>This week’s exercises are donated from a well-known Database Systems textbook, and will help you deepen and strengthen your understanding of how relational databases are organized.  This deeper understanding will help you navigate complicated business databases, and allow you to write more efficient queries.  At the conclusion of the week, you will test your understanding of database design principles by completing the Week 1 graded quiz.</p> <p>To get started, please begin with the video “Problems with Having a Lot of Data Used by a Lot of People.” <p>As always, if you have any questions, post them to the Discussions. <p>I hope you enjoy this week's materials!"
679, Queries to Extract Data from Single Tables ,6,https://www.coursera.org/learn/analytics-mysql?specialization=excel-mysql,"Welcome to week 2! This week, you will start interacting with business databases. You will write SQL queries that query data from two real companies. One data set, donated from a local start-up in Durham, North Carolina called Dognition, is a MySQL database containing tables of over 1 million rows. The other data set, donated from a national US department store chain called Dillard’s, is a Teradata database containing tables with over a hundred million rows. By the end of the week, you will be able to:1.  Use two different database user interfaces2.  Write queries to verify and describe all the contents of the Dognition MySQL database and the Dillard’s Teradata database3.  Retrieve data that meet specific criteria in a socially-responsible using SELECT, FROM, WHERE, LIMIT, and TOP clauses, and4.  Format the data you retrieve using aliases, DISTINCT clauses, and ORDER BY clauses.Make sure to watch the instructional videos about how to use the database interfaces we have established for this course, and complete both the MySQL and the Teradata exercises. At the end of the week, you will test your understanding of the SQL syntax introduced this week by completing the Week 2 graded quiz.To get started, please begin with the video “Introduction to Week 2.”  As always, if you have any questions, post them to the Discussions. Enjoy this week's materials!"
680,Queries to Summarize Groups of Data from Multiple Tables ,6,https://www.coursera.org/learn/analytics-mysql?specialization=excel-mysql,"<p>Welcome to week 3! This week, we are going to learn the SQL syntax that allows you to segment your data into separate categories and segment.  We are also going to learn how to combine data stored in separate tables.</p><p>By the end of the week, you will be able to:</p><ul><li>Summarize values across entire columns, and break those summaries up according to specific variables or values in others columns using GROUP BY and HAVING clauses</li><li>Combine information from multiple tables using inner and outer joins</li><li>Use strategies to manage joins between tables with duplicate rows, many-to-many relationships, and atypical configurations</li><li>Practice one of the slightly more challenging use cases of aggregation functions, and</li><li>Work with the Dognition database to learn more about how MySQL handles mismatched aggregation levels.</li></ul><p>Make sure to watch the videos about joins, and complete both the MySQL and the Teradata exercises. At the end of the week, you will test your understanding of the SQL syntax introduced this week by completing the Week 3 graded quiz.</p><p>We strongly encourage you to use the course Discussions to help each other with questions. </p> <p>To get started, please begin with the video 'Welcome to Week 3.’</p><p>I hope you enjoy this week’s materials!</p>"
681, Queries to Address More Detailed Business Questions,6,https://www.coursera.org/learn/analytics-mysql?specialization=excel-mysql,"<p>Welcome to week 4, the final week of Managing Big Data with MySQL!  This week you will practice integrating the SQL syntax you’ve learn so far into queries that address analysis questions typical of those you will complete as a business data analyst.</p>  <p>By the end of the week, you will be able to:</p><ul><li>Design and execute subqueries</li><li>Introduce logical conditions into your queries using IF and CASE statements</li><li>Implement analyses that accommodate missing data or data mistakes, and</li><li>Write complex queries that incorporate many tables and clauses.</li></ul><p>By the end of this week you will feel confident claiming that you know how to write SQL queries to create business value. Due to the extensive nature of the queries we will practice this week, we have put the graded quiz that tests your understanding of the SQL strategies you will practice in its own week rather than including it in this week’s materials. </p> <p>Make sure to complete both the MySQL exercises and the Teradata exercises, and we strongly encourage you to use the course Discussions to help each other with questions.  </p><p>To get started, please begin with the video 'Welcome to Week 4.’</p><p>I hope you enjoy this week’s materials!</p>"
682,Strengthen and Test Your Understanding ,6,https://www.coursera.org/learn/analytics-mysql?specialization=excel-mysql,"This week contains the final ungraded Teradata exercises, and the final graded quiz for the course. The exercises are intended to hone and build your understanding of the last important concepts in the course, and lead directly to the quiz so be sure to do both!"
683,Overview,4,https://www.coursera.org/learn/introduction-genomics?specialization=genomic-data-science,"In this Module, you can expect to study topics of ""Just enough molecular biology"", ""The genome"", ""Writing a DNA sequence"", ""Central dogma"", ""Transcription"", ""Translation"", and ""DNA structure and modifications""."
684,Measurement Technology,4,https://www.coursera.org/learn/introduction-genomics?specialization=genomic-data-science,"In this module, you'll learn about polymerase chain reaction, next generation sequencing, and applications of sequencing."
685,Computing Technology,4,https://www.coursera.org/learn/introduction-genomics?specialization=genomic-data-science,"The lectures for this module cover a few basic topics in computing technology. We'll go over the foundations of computer science, algorithms, memory and data structures, efficiency, software engineering, and computational biology software."
686,Data Science Technology,4,https://www.coursera.org/learn/introduction-genomics?specialization=genomic-data-science,"In this module on Data Science Technology, we'll be covering quite a lot of information about how to handle the data produced during the sequencing process. We'll cover reproducibility, analysis, statistics, question types, the central dogma of inference, analysis code, testing, prediction, variation, experimental design, confounding, power, sample size, correlation, causation, and degrees of freedom."
687,Introduction,4,https://www.coursera.org/learn/galaxy-project?specialization=genomic-data-science,"This week, we will present some of the research challenges that motivated the development of the Galaxy framework. We will then introduce Galaxy, describe what the Galaxy framework is, and look at different ways you can use it."
688,Galaxy 101,4,https://www.coursera.org/learn/galaxy-project?specialization=genomic-data-science,In this module and the following modules we will start to use Galaxy to perform different types of analysis. 
689,Working with sequence data,4,https://www.coursera.org/learn/galaxy-project?specialization=genomic-data-science,In this module we will be studying sequence data quality control as well as ChIP-Sequence Analysis with MACS.
690,RNA-seq & Running your own Galaxy,4,https://www.coursera.org/learn/galaxy-project?specialization=genomic-data-science,"In these final modules, we'll take a look at working with sequence data and RNA-seq and at installing and running your own Galaxy."
691,Week One,4,https://www.coursera.org/learn/python-genomics?specialization=genomic-data-science,This week we will have an overview of Python and take the first steps towards programming.
692,Week Two,4,https://www.coursera.org/learn/python-genomics?specialization=genomic-data-science,"In this module, we'll be taking a look at Data Structures and Ifs and Loops."
693,Week Three,4,https://www.coursera.org/learn/python-genomics?specialization=genomic-data-science,"In this module, we have a long three-part lecture on Functions as well as a 10-minute look at Modules and Packages."
694,Week Four,4,https://www.coursera.org/learn/python-genomics?specialization=genomic-data-science,"In this module, we have another long three-part lecture, this time about Communicating with the Outside, as well as a final lecture about Biopython."
695,"DNA sequencing, strings and matching",4,https://www.coursera.org/learn/dna-sequencing?specialization=genomic-data-science,"This module we begin our exploration of algorithms for analyzing DNA sequencing data. We'll discuss DNA sequencing technology, its past and present, and how it works."
696,"Preprocessing, indexing and approximate matching",4,https://www.coursera.org/learn/dna-sequencing?specialization=genomic-data-science,"In this module, we learn useful and flexible new algorithms for solving the exact and approximate matching problems.  We'll start by learning Boyer-Moore, a fast and very widely used algorithm for exact matching"
697,"Edit distance, assembly, overlaps",4,https://www.coursera.org/learn/dna-sequencing?specialization=genomic-data-science,"This week we finish our discussion of read alignment by learning about algorithms that solve both the edit distance problem and related biosequence analysis problems, like global and local alignment."
698,Algorithms for assembly,4,https://www.coursera.org/learn/dna-sequencing?specialization=genomic-data-science,"In the last module we began our discussion of the assembly problem and we saw a couple basic principles behind it.  In this module, we'll learn a few ways to solve the alignment problem."
699,Введение,4,https://www.coursera.org/learn/mathematics-and-python?specialization=machine-learning-data-analysis,"Добро пожаловать! На этой неделе мы начнём осваивать язык Python — один из главных инструментов специалиста в науке о данных, и вспомним кое-что о производных, которые активно используются при настройке моделей машинного обучения."
700,Библиотеки Python и линейная алгебра,4,https://www.coursera.org/learn/mathematics-and-python?specialization=machine-learning-data-analysis,"На этой неделе мы познакомимся с Python-библиотеками, содержащими большое количество полезных инструментов: от быстрых операций с многомерными массивами до визуализации и реализации различных математических методов. Кроме того, мы освоим линейную алгебру — основной математический аппарат для работы с данными: в большинстве задач данные можно представить в виде векторов или матриц."
701,Оптимизация и матричные разложения,4,https://www.coursera.org/learn/mathematics-and-python?specialization=machine-learning-data-analysis,"На этой неделе мы научимся с помощью методов оптимизации находить наилучшие значения параметров системы, чтобы минимизировать затраты или максимизировать точность предсказаний, а также познакомимся с матричными разложениями, которые используются при построении регрессионных моделей, для уменьшения размерности данных, в рекомендательных системах и в анализе текстов. "
702,Случайность,4,https://www.coursera.org/learn/mathematics-and-python?specialization=machine-learning-data-analysis,"На этой неделе мы освоим базовые концепции теории вероятностей и статистики, которые необходимы для понимания механизма работы практически всех методов анализа данных. Мы разберёмся с самыми популярными распределениями, узнаем, какие явления ими описываются и какими статистиками оцениваются их параметры, а также научимся строить доверительные интервалы."
703,Машинное обучение и линейные модели,5,https://www.coursera.org/learn/supervised-learning?specialization=machine-learning-data-analysis,"Добро пожаловать на курс ""Обучение на размеченных данных""! В этом модуле вы узнаете, что такое машинное обучение, какие в нём бывают постановки задачи, и что особенного в обучении на размеченных данных. Затем вы изучите один из основных способов решения задач обучения на размеченных данных — предсказание с помощью линейных моделей. Мы обсудим, как их настраивать и применять в задачах регрессии и классификации. В практических заданиях вы поработаете с настоящими данными и узнаете, какие проблемы в них можно обнаружить, а также попробуете делать прогнозы при помощи линейных моделей."
704,Борьба с переобучением и оценивание качества,5,https://www.coursera.org/learn/supervised-learning?specialization=machine-learning-data-analysis,"Вторая неделя нашего курса будет посвящена общим вопросам, с которыми приходится столкнуться в любой задаче анализа данных. Вы узнаете, что такое проблема переобучения, из-за чего она возникает, как её можно обнаружить и как с ней бороться — в частности, вы познакомитесь с кросс-валидацией, с помощью которой можно оценить способность алгоритма давать хорошие предсказания на новых данных. Далее речь пойдёт о метриках качества — без них невозможно понять, подходит ли алгоритм для решения той или иной задачи. Наконец, вы познакомитесь с библиотекой scikit-learn, которая является одним из основных инструментов современных специалистов по анализу данных."
705,Линейные модели: классификация и практические аспекты,5,https://www.coursera.org/learn/supervised-learning?specialization=machine-learning-data-analysis,"Добро пожаловать на третью неделю курса! Вы уже поработали с линейными моделями, научились измерять их качество и устранять переобучение с помощью регуляризации. Пришло время разобраться, почему регуляризация действительно помогает уменьшить сложность модели или произвести отбор признаков — об этом пойдёт речь в первом уроке. Там же вы познакомитесь с логистической регрессией, которая является одним из наиболее популярных методов для решения задач классификации. Далее вы узнаете о некоторых важных нюансах работы с линейными моделями: масштабировании признаков, переходе в новые признаковые пространства и т.д. Мы не только расскажем обо всём этом, но и покажем, как оно работает в Python и библиотеке scikit-learn."
706,Решающие деревья и композиции алгоритмов,5,https://www.coursera.org/learn/supervised-learning?specialization=machine-learning-data-analysis,"Линейные модели — очень важный и полезный, но слишком простой класс алгоритмов в машинном обучении; не во всех задачах они позволяют добиться желаемого качества. В этом модуле вы познакомитесь с новым семейством алгоритмов — решающими деревьями. Они во многом являются полной противоположностью линейных моделей. В частности, сами по себе они очень сложны и подвержены переобучению. При этом оказывается, что если объединить много деревьев в одну сложную модель, то можно получить очень качественное решение. Об этом крайне важном подходе — построении композиций решающих деревьев — мы в основном и будем говорить на этой неделе."
707,Нейронные сети и обзор методов,5,https://www.coursera.org/learn/supervised-learning?specialization=machine-learning-data-analysis,"Рады приветствовать вас на последней, пятой неделе курса! Мы расскажем ещё о нескольких подходах к решению задач машинного обучения, которые не были затронуты в предыдущих модулях, но при этом играют важную роль в практических задачах. Это нейронные сети, байесовские модели, метрические методы. Вы узнаете, для чего они нужны, и попробуете самостоятельно применить их в практических заданиях."
