,Section Names,Section Length,Chapter Links,Section Descriptions
245,Discrete Probability,6,https://www.coursera.org/learn/discrete-math-and-analyzing-social-graphs,"Probability theory is a mathematical foundation of Statistics, the core of Data Science. During this week we study discrete probability, the first chapter of the probability theory, closely related to combinatorics. We discuss random experiments, their outcomes and events, introduce the notion of probability and some basic rules that follow immediately from the combinatorial results studied before. We also study simple probabilistic models like coin-tossing that will be used later."
246,Introduction to Graphs,6,https://www.coursera.org/learn/discrete-math-and-analyzing-social-graphs,"Graphs represent objects and relations between them in a compact geometric form. Objects are represented by vertices of a graph and relations correspond to edges. Applications of graphs include geoinformational systems (vertices are cities, edges are roads), social network analysis (people and friendship relations), chemistry (graphs of molecular structure), computer network topology, and many more. During this week, we introduce basic notions of graph theory and discuss basic algorithms on graphs."
247,Basic Graph Parameters,6,https://www.coursera.org/learn/discrete-math-and-analyzing-social-graphs,"Graph parameters, also called graph properties and graph invariants, are values (usually numerical), which are calculated for a given graph and depend only on its abstract structure (not, say, on a particular way of drawing the graph on a plane). Graph parameters are useful in data science, since they reduce a big amount of data (the graph) to a small one (the parameter), while conveying important information about the graph. We discuss some of the basic graph parameters in this module."
248,Graphs of Social Networks,6,https://www.coursera.org/learn/discrete-math-and-analyzing-social-graphs,"In this final part of the course we discuss a Python library for working with graphs, called NetworkX. In NetworkX, one can create and modify graphs, compute graph parameters, visualize graphs, etc. We shall show how NetworkX is used to operate on graphs coming from a real-world dataset."
249,"Introduction: Numerical Sets, Functions, Limits",6,https://www.coursera.org/learn/calculus-and-optimization-for-machine-learning,"Here we introduce basic concept the calculus course could not be imagine without: function. In order to properly do it, one should say that the function is a mapping from one set to another. Thus, we start with the ideas of numerical sets and mapping, then proceeding with functions itself. Since we are particularly interested in functions' graph, we spend a lot of time discussing simplest ways to produce a complex function graph from elementary case. In the second part of the week we start our calculus journey with a discrete limit, the limit of sequences, and master skills needed to calculate them."
250,Limits and Multivariate Functions,6,https://www.coursera.org/learn/calculus-and-optimization-for-machine-learning,"Now it is time to move from discrete limits to continuous ones: in other words, in the current module we are going to discuss limits of functions. We start with the basic question: does this case sufficiently differ from the sequences? Turns out, yes, it does thanks to significant structural differences between natural and real numbers. One of those differences - the continuousness - allows us to define and calculate limits at finite  moments. We spend some time specifically on the famous important limits, then we proceed with the idea of asymptotic comparison of functions, Big- and little-o notations. To top our module with, we introduce functions of several variables and spend some time getting used to conveniently plot and interpret them, finishing up with discussion of its limits."
251,Derivatives and Linear Approximations: Singlevariate Functions,6,https://www.coursera.org/learn/calculus-and-optimization-for-machine-learning,"Since we now know limits, let us use them in order to define some instantaneous characteristics of functions starting with its slope. Thus we define function's derivative and discuss all the machinery to calculate it. Since it is a purely technical issue, you are expected to be able to do it: in order to make sure that you can find a derivative we provide a drill. This skills could be used for finding approximate values via linear approximation or during the search for extremal values. To provide an understanding of the sufficient condition of the extremum, we introduce the concept of convexity."
252,Derivatives and Linear Approximations: Multivariate Functions,6,https://www.coursera.org/learn/calculus-and-optimization-for-machine-learning,"Whilst we have discussed all linear related concepts for single variate functions, it is essential to try and generalise it for the multivariate case. Since the derivative concept is hard to stretch directly, we start with the idea of linear approximation and tangent plane; thus we introduce partial derivatives and the differentiability. We separately spend sometime discussing neural network inspired composite multivariate functions and all-mighty chain rule. Our generalisation attempt finalised with the idea of convexity in terms of the second partial derivatives."
253,"Integrals: Anti-derivative, Area under Curve",6,https://www.coursera.org/learn/calculus-and-optimization-for-machine-learning,"As we introduced the operation of differentiation, it is essential to think about the inverse procedure - the integration. We start the module with basic definition of the integration and, as usual, all techniques required to calculate wide range of the indefinite integrals, stressing out that the result is not guaranteed now. Then we proceed with the idea and formal definition of area under curve and its relation to the indefinite case - the fundamental theorem of calculus. We finish our week with the discussion of the areas of infinite figures (improper integrals) and numerical methods to assess the value of the definite integral."
254,"Optimization: Directional derivative, Extrema and Gradient Descent",6,https://www.coursera.org/learn/calculus-and-optimization-for-machine-learning,"As we built up impressive base by introducing various estimations of change and overall function's behaviour, it is essential to speak about general idea of the optimisation procedure. Since we already tackled it in a single variate case, we try to generalise our principles of necessary and sufficient conditions to the case of multivariate functions. Whilst it provides theoretical understanding, one should seek for faster iterative way to find an extremal point. In order to do it, we start our week with the concept of the directional derivative in order to provide and understanding of the desired direction of iterative search. Thus we produce the idea and motivation of the gradient descent, the last  and final concept in our course you are asked to master."
255,Systems of linear equations and linear classifier ,4,https://www.coursera.org/learn/first-steps-in-linear-algebra-for-machine-learning,"In the first week we provide an introduction to multi-dimensional geometry and matrix algebra. After that, we study methods for finding linear system solutions based on Gaussian eliminations and LU-decompositions. We illustrate the methods with Python code examples of matrix calculations."
256,Full rank decomposition and systems of linear equations,4,https://www.coursera.org/learn/first-steps-in-linear-algebra-for-machine-learning,"The second week is devoted to getting to know some fundamental notions of  linear algebra, namely: vector spaces, linear independence, and basis. Next, we will discuss what a rank of a matrix is, and how it could help us decompose a matrix.  In addition, we will talk about the properties of a set of solutions for a system of linear equations. At the end of this week we will apply this theory to a scanned document processing."
257,Euclidean spaces ,4,https://www.coursera.org/learn/first-steps-in-linear-algebra-for-machine-learning,"In the third week, we firstly introduce coordinates in an abstract vector space. This allows us to apply the usual matrix arithmetic to abstract vectors. Next, we discuss the concept of Euclidean space which allows us to measure distances and angles in vector spaces. Then we use these measures in the least squares method to find approximate solutions of linear systems and in the linear regression model based on it. Finally, we describe the core of the most common linear classifier called Support Vector Machine. "
258,Final Project,4,https://www.coursera.org/learn/first-steps-in-linear-algebra-for-machine-learning,In this week we will apply the acquired knowledge about linear regression and SVM models in this final project.  
259,Conditional probability and Independence,6,https://www.coursera.org/learn/probability-theory-statistics,"During this week we discuss conditional probability and independence of events. Sometimes we can use this definition to find probabilities. Sometimes we check that this definition fulfills to assure whether events are independent. We discuss important law of total probability, which allows us to find probability of some event when we know its conditional probabilities provided some hypotheses and probabilities of the hypotheses. We also discuss Bayes's rule which allows us to find probability of hypothesis provided that some event occurred. We demonstrate how Python can be used for calculating conditional probabilities and checking independence of events."
260,Random variables,6,https://www.coursera.org/learn/probability-theory-statistics,"Random variable denotes a value that depends on the result of some random experiment. Some natural examples of random variables come from gambling and lotteries. There are two main classes of random variables that we will consider in this course. This week we'll learn discrete random variables that take finite or countable number of values. Discrete random variables can be described by their distribution. We'll consider various discrete distributions, introduce notions of expected value and variance and learn to generate and visualize discrete random variables with Python."
261,"Systems of random variables; properties of expectation and variance, covariance and correlation.",6,https://www.coursera.org/learn/probability-theory-statistics,"Several random variables associated with the same random experiment constitute a system of random variables. To describe system of discrete random variables one can use joint distribution, which takes into account all possible combinations of values that random variables may take. We'll find some joint distributions, research their properties and introduce independence of random variables. Then we'll discuss properties of expected value and variance with respect to arithmetic operations and introduce measures of independence between random variables."
262,Continuous random variables,6,https://www.coursera.org/learn/probability-theory-statistics,"This week we'll study continuous random variables that constitute important data type in statistics and data analysis. For continuous random variables we'll define probability density function (PDF) and cumulative distribution function (CDF), see how they are linked and how sampling from random variable may be used to approximate its PDF. We'll introduce expected value, variance, covariance and correlation for continuous random variables and discuss their properties. Finally, we'll use Python to generate independent and correlated continuous random variables."
263,From random variables to statistical data. Data summarization and descriptive statistics.,6,https://www.coursera.org/learn/probability-theory-statistics,"This week we'll introduce types of statistical data and discuss models that are used to pass from statistical data to random variables. We'll introduce descriptive statistics of sample data, such as various measures of central tendency and statistical dispersion, and find correspondences between properties of random variables (population) and the sample descriptive statistics, which are essential for statistical predictions. We’ll talk about visualization of statistical data and learn to work with them in Python."
264,Correlations and visualizations,6,https://www.coursera.org/learn/probability-theory-statistics,"This week we’ll consider correlation in statistical data and find out how its' related to the level of dependance  within the data and what it means for scatter plots. We’ll consider several types of correlation suitable for different types of data and discuss difference between correlation and causation. Finally, we’ll learn to visualize dependence between numeric variables and calculate correlation with Python."
265,Introduction the course and grading environment,4,https://www.coursera.org/learn/ds,
266,Tools that support BigData solutions,4,https://www.coursera.org/learn/ds,
267,Scaling Math for Statistics on Apache Spark,4,https://www.coursera.org/learn/ds,
268,Data Visualization of Big Data,4,https://www.coursera.org/learn/ds,
269,Setting the stage,4,https://www.coursera.org/learn/advanced-machine-learning-signal-processing,
270,Supervised Machine Learning,4,https://www.coursera.org/learn/advanced-machine-learning-signal-processing,
271,Unsupervised Machine Learning,4,https://www.coursera.org/learn/advanced-machine-learning-signal-processing,
272,Digital Signal Processing in Machine Learning,4,https://www.coursera.org/learn/advanced-machine-learning-signal-processing,
273,Introduction to deep learning,4,https://www.coursera.org/learn/ai,
274,DeepLearning Frameworks,4,https://www.coursera.org/learn/ai,
275,DeepLearning Applications,4,https://www.coursera.org/learn/ai,
276,Scaling and Deployment,4,https://www.coursera.org/learn/ai,
277,Week 1 - Identify DataSet and UseCase,4,https://www.coursera.org/learn/advanced-data-science-capstone,"In this module, the basic process model used for this capstone project is introduced. Furthermore, the learner is required to identify a practical use case and data set"
278,Week 2 - ETL and Feature Creation,4,https://www.coursera.org/learn/advanced-data-science-capstone,"This module emphasizes on the importance of ETL, data cleansing and feature creation as a preliminary step in ever data science project "
279,Week 3 - Model Definition and Training,4,https://www.coursera.org/learn/advanced-data-science-capstone,This module emphasizes on model selection based on use case and data set. It is important to understand how those two factors impact choice of a useful model algorithm. 
280,"Model Evaluation, Tuning, Deployment and Documentation",4,https://www.coursera.org/learn/advanced-data-science-capstone,"One a model is trained it is important to assess its performance using an appropriate metric. In addition, once the model is finished, it has to be made consumable by business stakeholders in an appropriate way  "
281,Introduction to Data Analytics,4,https://www.coursera.org/learn/decision-making?specialization=pwc-analytics,"In this module you'll learn the basics of data analytics and how businesses use to solve problems. You'll learn the value data analytics brings to business decision-making processes. We’ll introduce you to a framework for data analysis and tools used in data analytics. Finally, we’re going to talk about careers and roles in data analytics and data science."
282,Technology and types of data ,4,https://www.coursera.org/learn/decision-making?specialization=pwc-analytics,This module is an introductory look at big data and big data analytics where you will learn the about different types of data. We’ll also introduce you to PwC's perspective on big data and explain the impact of big data on businesses.  Finally we will name some of the different types of tools and technologies used to gather data.
283,Data analysis techniques and tools,4,https://www.coursera.org/learn/decision-making?specialization=pwc-analytics,In this module we will describe some of the tools for data analytics and some of the key technologies for data analysis. We will talk about how visualization is important to the practice of data analytics. Finally we will identify a variety of tools and languages used and consider when those tools are best used.
284,Data-driven decision making project ,4,https://www.coursera.org/learn/decision-making?specialization=pwc-analytics,"The course project will give you an opportunity to practice what you have learned.  You will participate in a simulated business situation in which you will select the best course of action.  You will then prepare a final deliverable which will be evaluated by your peers.  Additionally, you will have the opportunity to provide feedback on your peer's submissions.  "
285,Overview of Excel,4,https://www.coursera.org/learn/excel-analysis?specialization=pwc-analytics,"In this module, you will learn the basics of Excel navigation and Excel basic functionality. You will learn how to navigate the basic Excel screen including using formulas, subtotals and text formatting. We will provide you an opportunity to perform a problem solving exercise using basic Excel skills. Note: We recommend viewing videos in full-screen mode by clicking the double arrow in the lower right hand corner of your screen."
286,vLookups and Data Cleansing,4,https://www.coursera.org/learn/excel-analysis?specialization=pwc-analytics,"In this module you will learn about VLookup, value cleansing and text functions. We will also introduce you to PwC's perspective on the value in cleansing data and using the appropriate functions.  Finally, we will provide you an opportunity to perform a problem solving exercise using VLookup, value cleansing and text function. Note: We recommend viewing videos in full-screen mode by clicking the double arrow in the lower right hand corner of your screen."
287,Logical Functions & Pivot Tables,4,https://www.coursera.org/learn/excel-analysis?specialization=pwc-analytics,"In this module, you will learn about logical functions and pivot tables. We will show you how to create and use pivot tables to solve business problems. We will give you an opportunity to practice creating and using a pivot table to solve a business problem. Finally, we will share some insight on PwC’s perspectives on the impact of Excel on your career and work. Note: We recommend viewing videos in full-screen mode by clicking the double arrow in the lower right hand corner of your screen."
288,More Advanced Formulas,4,https://www.coursera.org/learn/excel-analysis?specialization=pwc-analytics,"In this module you will learn more advanced Excel formulas. We will show you how to create statistical formulas, perform an index match, and lastly, build financial formulas. We will provide you with an opportunity to problem solve using statistical formulas. Finally, we will give you an opportunity to practice what you have learned through a final project. Note: We recommend viewing videos in full-screen mode by clicking the double arrow in the lower right hand corner of your screen."
289,Preparing a Professional Excel ,4,https://www.coursera.org/learn/advanced-excel?specialization=pwc-analytics,"During this first week, you are going to learn about the development of data models and databases.  We will cover the components of data sets and the relational database models, database keys, relationships, and joins.  We will also look at a tool called PowerPivot that is used to import and prepare data to build relational models, as well as visualize data.  By the end of the week, you will have a working knowledge of how to develop a data model. Be sure to complete lessons in the order in which they are sequenced in the course."
290,Advanced Scenario Analysis ,4,https://www.coursera.org/learn/advanced-excel?specialization=pwc-analytics,"This week, we are going to explore three different analytical methods used to help model different scenarios and deal with variable uncertainty. These methods are scenario analysis, sensitivity analysis and simulation.  We’ll look at what each method is and then go deeper into why and how you use each.  Following some guided demonstration, you’ll be given a chance to practice in an Excel workbook and demonstrate what you’ve learned. "
291,Data Visualization,4,https://www.coursera.org/learn/advanced-excel?specialization=pwc-analytics,"This week we are going to focus on data visualization. We will start off by discussing data visualization basics, outlining the theory and concepts behind data visualization. We will also discuss how to enable effective story telling through the correct selection, creation, and presentation of tables and charts. You’ll get a chance to learn how to create detailed graphs and charts to effectively tell a story about your data. "
292,Dashboarding ,4,https://www.coursera.org/learn/advanced-excel?specialization=pwc-analytics,"In the final week of this course, you are going to learn how to create a dynamic dashboard. We are going to discuss how to establish a good understanding of your audience and how to collect key requirements in order to determine what type of dashboard to build.  We will talk about some guiding design principles and things to consider when building a dashboard. You’ll have a chance to practice everything you learn this week by creating your own functional dashboard in Excel.  "
293,Preparing a Presentation,4,https://www.coursera.org/learn/powerpoint-presentations?specialization=pwc-analytics,"This course is about presenting the story of the data, using PowerPoint. You'll learn how to structure a presentation and how to include insights and supporting data. You'll also learn some design principles for creating effective PowerPoint slides with visuals displaying data. Though application based exercises, you'll gain foundational communication skills - including public speaking, professional presence and compelling storytelling. Finally, you'll be given a client profile, a business problem, and a set of basic Excel charts, that you will use to create  a presentation.  You’ll receive peer feedback that you can use to enhance future presentations. This course was created by PricewaterhouseCoopers LLP with an address at 300 Madison Avenue, New York, New York, 10017"
294,Communication styles,4,https://www.coursera.org/learn/powerpoint-presentations?specialization=pwc-analytics,"This week, we will be covering the different types of communications styles.  You’ll start off by gaining an understanding of your personal professional presence and learn how to maximize it.  You’ll learn about verbal and nonverbal communications, and strategies to enhance your questioning and listening skills. We will also discuss how differences in culture can impact how you communicate."
295,Creating effective slides using PowerPoint,4,https://www.coursera.org/learn/powerpoint-presentations?specialization=pwc-analytics,"This week, we're discussing how to create effective slides using PowerPoint. You’ll learn about the tools available within PowerPoint, how to structure your storyline, create storyboards, identify primary elements of slide design, display data and finalize your slide presentation. There is a peer review activity where you will apply the skills learned and create a storyboard. Finally, you will also get a chance to identify errors in a presentation to test your knowledge of standard industry practices."
296,Delivering a presentation,4,https://www.coursera.org/learn/powerpoint-presentations?specialization=pwc-analytics,"This week, you’re going to build and deliver a presentation to your peers, and receive feedback from them.  You will create a presentation of about 10 slides, employing the guidelines and industry best practices that have been discussed in this course. You can use the presentation storyboard that you created last week, which your peers have reviewed and given you feedback on.  Review what you’ve developed so far, and make changes or additions that you think will enhance the presentation. Once you’ve finalized your presentation, you will present it in a video using your smartphone or computer.Once you’re satisfied with the PowerPoint presentation and video, you will be submitting both for peer review.  You can use this feedback for current and future presentations that you will make during your career."
297,The Role of Statistics in Public Health Research,6,https://www.coursera.org/learn/summary-statistics,"Within this learning module, you will learn how statistics are used within public heath research. Topics covered include study design types, data types, and data summarization. You will complete a practice quiz before completing a graded quiz. "
298,Continuous Data Measures,6,https://www.coursera.org/learn/summary-statistics,"Module two involves several lectures, a practice quiz and a graded quiz. Topics include summary statistics, visual displays, role of sample size, and continuous data. "
299,The Normal Distribution,6,https://www.coursera.org/learn/summary-statistics,"The focus of this module is on normal distribution. Topics covered include defining the standard normal distribution, and application of principles of normal distribution to sample data. There is a practice quiz where you can test your knowledge before completing the graded quiz. "
300,Binary Data,6,https://www.coursera.org/learn/summary-statistics,"Module four covers binary data and its significance.  In addition to lectures, you will complete a practice quiz and a graded quiz. "
