,Section Names,Section Length,Chapter Links,Section Descriptions
0,About Introduction to Probability and Data,9,https://www.coursera.org/learn/probability-intro?specialization=statistics,"This course introduces you to sampling and exploring data, as well as basic probability theory. You will examine various types of sampling methods and discuss how such methods can impact the utility of a data analysis. The concepts in this module will serve as building blocks for our later courses.Each lesson comes with a set of learning objectives that will be covered in a series of short videos. Supplementary readings and practice problems will also be suggested from OpenIntro Statistics, 3rd Edition, https://leanpub.com/openintro-statistics/, (a free online introductory statistics textbook, that I co-authored). There will be weekly quizzes designed to assess your learning and mastery of the material covered that week in the videos. In addition, each week will also feature a lab assignment, in which you will use R to apply what you are learning to real data. There will also be a data analysis project designed to enable you to answer research questions of your own choosing. Since this is a Coursera course, you are welcome to participate as much or as little as you’d like, though I hope that you will begin by participating fully. One of the most rewarding aspects of a Coursera course is participation in forum discussions about the course materials. Please take advantage of other students' feedback and insight and contribute your own perspective where you see fit to do so. You can also check out the resource page (https://www.coursera.org/learn/probability-intro/resources/crMc4) listing useful resources for this course. Thank you for joining the Introduction to Probability and Data community! Say hello in the Discussion Forums. We are looking forward to your participation in the course."
1,Introduction to Data,9,https://www.coursera.org/learn/probability-intro?specialization=statistics,"Welcome to Introduction to Probability and Data! I hope you are just as excited about this course as I am! In the next five weeks, we will learn about designing studies, explore data via numerical summaries and visualizations, and learn about rules of probability and commonly used probability distributions. If you have any questions, feel free to post them on this module's forum (https://www.coursera.org/learn/probability-intro/module/rQ9Al/discussions?sort=lastActivityAtDesc&page=1) and discuss with your peers! To get started, view the learning objectives (https://www.coursera.org/learn/probability-intro/supplement/rooeY/lesson-learning-objectives) of Lesson 1 in this module."
2,Introduction to Data Project,9,https://www.coursera.org/learn/probability-intro?specialization=statistics,To complete this assignment you will use R and RStudio installed on your local computer or through RStudio Cloud.
3,Exploratory Data Analysis and Introduction to Inference,9,https://www.coursera.org/learn/probability-intro?specialization=statistics,"Welcome to Week 2 of Introduction to Probability and Data! Hope you enjoyed materials from Week 1. This week we will delve into numerical and categorical data in more depth, and introduce inference."
4,Exploratory Data Analysis and Introduction to Inference Project,9,https://www.coursera.org/learn/probability-intro?specialization=statistics,To complete this assignment you will use R and RStudio installed on your local computer or through RStudio Cloud.
5,Introduction to Probability,9,https://www.coursera.org/learn/probability-intro?specialization=statistics,"Welcome to Week 3 of Introduction to Probability and Data! Last week we explored numerical and categorical data. This week we will discuss probability, conditional probability, the Bayes’ theorem, and provide a light introduction to Bayesian inference. Thank you for your enthusiasm and participation, and have a great week! I’m looking forward to working with you on the rest of this course."
6,Introduction to Probability Project,9,https://www.coursera.org/learn/probability-intro?specialization=statistics,To complete this assignment you will use R and RStudio installed on your local computer or through RStudio Cloud.
7,Probability Distributions,9,https://www.coursera.org/learn/probability-intro?specialization=statistics,"Great work so far! Welcome to Week 4 -- the last content week of Introduction to Probability and Data! This week we will introduce two probability distributions: the normal and the binomial distributions in particular. As usual, you can evaluate your knowledge in this week's quiz. There will be no labs for this week. Please don't hesitate to post any questions, discussions and related topics on this week's forum (https://www.coursera.org/learn/probability-intro/module/VdVNg/discussions?sort=lastActivityAtDesc&page=1)."
8,Data Analysis Project,9,https://www.coursera.org/learn/probability-intro?specialization=statistics,"Well done! You have reached the last week of Introduction to Probability and Data! There will not be any new videos in this week, instead, you will be asked to complete an initial data analysis project with a real-world data set. The project is designed to help you discover and explore research questions of your own, using real data and statistical methods we learn in this class. The the project will be graded via peer assessments, meaning that you will need to evaluate three peers' projects after submitting your own. Get started with your data analysis in this week! It should be interesting and very exciting! As usual, feel free to post questions, concerns, and comments about the project on this week's forum (https://www.coursera.org/learn/probability-intro/module/BaTDb/discussions?sort=lastActivityAtDesc&page=1)."
9,About the Specialization and the Course,6,https://www.coursera.org/learn/inferential-statistics-intro?specialization=statistics,"This short module introduces basics about Coursera specializations and courses in general, this specialization: Statistics with R, and this course: Inferential Statistics. Please take several minutes to browse them through. Thanks for joining us in this course!"
10,Central Limit Theorem and Confidence Interval,6,https://www.coursera.org/learn/inferential-statistics-intro?specialization=statistics,"Welcome to Inferential Statistics! In this course we will discuss Foundations for Inference. Check out the learning objectives, start watching the videos, and finally work on the quiz and the labs of this week. In addition to videos that introduce new concepts, you will also see a few videos that walk you through application examples related to the week's topics. In the first week we will introduce Central Limit Theorem (CLT) and confidence interval."
11,Inference and Significance,6,https://www.coursera.org/learn/inferential-statistics-intro?specialization=statistics,"Welcome to Week Two! This week we will discuss formal hypothesis testing and relate testing procedures back to estimation via confidence intervals. These topics will be introduced within the context of working with a population mean, however we will also give you a brief peek at what's to come in the next two weeks by discussing how the methods we're learning can be extended to other estimators. We will also discuss crucial considerations like decision errors and statistical vs. practical significance. The labs for this week will illustrate concepts of sampling distributions and confidence levels."
12,Inference for Comparing Means,6,https://www.coursera.org/learn/inferential-statistics-intro?specialization=statistics,"Welcome to Week Three of the course! This week we will introduce the t-distribution and comparing means as well as a simulation based method for creating a confidence interval: bootstrapping. If you have questions or discussions, please use this week's forum to ask/discuss with peers."
13,Inference for Proportions,6,https://www.coursera.org/learn/inferential-statistics-intro?specialization=statistics,"Welcome to Week Four of our course! In this unit, we’ll discuss inference for categorical data. We use methods introduced this week to answer questions like “What proportion of the American public approves of the job of the Supreme Court is doing?”."
14, Data Analysis Project,6,https://www.coursera.org/learn/inferential-statistics-intro?specialization=statistics,"In this week you will use the data set provided to complete and report on a data analysis question. Please read the background information, review the report template (downloaded from the link in Lesson Project Information), and then complete the peer review assignment. "
15,About Linear Regression and Modeling,5,https://www.coursera.org/learn/linear-regression-model?specialization=statistics,"This short module introduces basics about Coursera specializations and courses in general, this specialization: Statistics with R, and this course: Linear Regression and Modeling. Please take several minutes to browse them through. Thanks for joining us in this course!"
16,Linear Regression,5,https://www.coursera.org/learn/linear-regression-model?specialization=statistics,"In this week we’ll introduce linear regression. Many of you may be familiar with regression from reading the news, where graphs with straight lines are overlaid on scatterplots. Linear models can be used for prediction or to evaluate whether there is a linear relationship between two numerical variables. "
17,More about Linear Regression,5,https://www.coursera.org/learn/linear-regression-model?specialization=statistics,"Welcome to week 2! In this week, we will look at outliers, inference in linear regression and variability partitioning. Please use this week to strengthen your understanding on linear regression. Don't forget to post your questions, concerns and suggestions in the discussion forum!"
18,Multiple Regression,5,https://www.coursera.org/learn/linear-regression-model?specialization=statistics,"In this week, we’ll explore multiple regression, which allows us to model numerical response variables using multiple predictors (numerical and categorical). We will also cover inference for multiple linear regression, model selection, and model diagnostics. Hope you enjoy!"
19,Final Project,5,https://www.coursera.org/learn/linear-regression-model?specialization=statistics,"In this week you will use the data set provided to complete and report on a data analysis question. Please read the background information, review the report template (downloaded from the link in Lesson Project Information), and then complete the peer review assignment. "
20,About the Specialization and the Course,7,https://www.coursera.org/learn/bayesian?specialization=statistics,"This short module introduces basics about Coursera specializations and courses in general, this specialization: Statistics with R, and this course: Bayesian Statistics. Please take several minutes read this information. Thanks for joining us in this course!"
21,The Basics of Bayesian Statistics,7,https://www.coursera.org/learn/bayesian?specialization=statistics,"<p>Welcome! Over the next several weeks, we will together explore Bayesian statistics. <p>In this module, we will work with conditional probabilities, which is the probability of event B given event A. Conditional probabilities are very important in medical decisions. By the end of the week, you will be able to solve problems using Bayes' rule, and update prior probabilities.</p><p>Please use the learning objectives and practice quiz to help you learn about Bayes' Rule, and apply what you have learned in the lab and on the quiz. "
22,Bayesian Inference,7,https://www.coursera.org/learn/bayesian?specialization=statistics,"In this week, we will discuss the continuous version of Bayes' rule and show you how to use it in a conjugate family, and discuss credible intervals. By the end of this week, you will be able to understand and define the concepts of prior, likelihood, and posterior probability and identify how they relate to one another."
23,Decision Making,7,https://www.coursera.org/learn/bayesian?specialization=statistics,"In this module, we will discuss Bayesian decision making, hypothesis testing, and Bayesian testing. By the end of this week, you will be able to make optimal decisions based on Bayesian statistics and compare multiple hypotheses using Bayes Factors. "
24,Bayesian Regression,7,https://www.coursera.org/learn/bayesian?specialization=statistics,"This week, we will look at Bayesian linear regressions and model averaging, which allows you to make inferences and predictions using several models. By the end of this week, you will be able to implement Bayesian model averaging, interpret Bayesian multiple linear regression and understand its relationship to the frequentist linear regression approach. "
25,Perspectives on Bayesian Applications,7,https://www.coursera.org/learn/bayesian?specialization=statistics,"This week consists of interviews with statisticians on how they use Bayesian statistics in their work, as well as the final project in the course."
26,Data Analysis Project,7,https://www.coursera.org/learn/bayesian?specialization=statistics,"In this module you will use the data set provided to complete and report on a data analysis question. Please read the background information, review the report template (downloaded from the link in Lesson Project Information), and then complete the peer review assignment. "
27,About the Capstone Project,8,https://www.coursera.org/learn/statistics-project,"Welcome to the capstone project! This week's content is an introduction to the project assignment and goals. The readings in this week will introduce the data set that you will be analyzing for your project and the specific questions you will answer using data analysis techniques we learned in the previous courses. It is important to understand what we will be doing in the course before jumping into the detailed analysis. So we encourage you to start with the first lecture to get the big picture, and then delve into the specifics of the analysis. Enjoy, and good luck! Remember, if you have questions, you can post them on the discussion forums."
28,Exploratory Data Analysis (EDA),8,https://www.coursera.org/learn/statistics-project,"This week you will work on conducting an exploratory analysis of the housing data. Exploratory analysis is an essential first step for familiarizing yourself with and understanding the data. In this week, you will complete a quiz which will guide you through certain important aspects of the data. The insights you gain through this assignment will help inform modeling in the future quizzes and peer assessments. 

Feel free to post questions about this assignment on the discussion forum."
29,EDA and Basic Model Selection - Submission,8,https://www.coursera.org/learn/statistics-project,"This week we will dig deeper into our exploratory data analysis of the data. We now have all the information and data necessary to perform a deep dive into the EDA and it is time start your initial analysis report! We encourage you to start your analysis report (presented in peer-review format next week) early so you will have enough time to complete it. You will conduct exploratory data analysis, model selection, and model evaluation, and then complete a written report which answers several questions which will guide you through the process. This report will be your first peer-review assignment in this course. "
30,EDA and Basic Model Selection - Evaluation,8,https://www.coursera.org/learn/statistics-project,Great work so far! We hope you will also learn as much from evaluating your peers' work as completing your own assignment. Happy learning!
31,Model Selection and Diagnostics,8,https://www.coursera.org/learn/statistics-project,"We are half way through the course! In this week, you will continue model selection and model diagnostics, which will serve a starting point for your final project. You will be assessed on your work through a quiz. If you have any questions so far, don't hesitate to post on the forum so that others can help and discuss the question together."
32,Out of Sample Prediction,8,https://www.coursera.org/learn/statistics-project,"In this week, you will gain experience using your model to perform out-of-sample prediction and validation.  The skills honed this week will guide you through your final analysis in the weeks to come.  Please feel free to go back to prior weeks and review the necessary background knowledge. "
33,Final Data Analysis - Submission,8,https://www.coursera.org/learn/statistics-project,"In the next two weeks, you will complete your final data analysis project. You will submit your answers using the Final Data Analysis peer review assignment link in Week 8."
34,Final Data Analysis - Evaluation,8,https://www.coursera.org/learn/statistics-project,"Congratulations on making through to the final week of the course! In this week, we will finish this data analysis project by completing the evaluation of three of your peers' assignments. "
35,WEEK 1 - INTRODUCTION TO DATA,4,https://www.coursera.org/learn/understanding-visualization-data,"In the first week of the course, we will review a course outline and discover the various concepts and objectives to be mastered in the weeks to come. You will get an introduction to the field of statistics and explore a variety of perspectives the field has to offer. We will identify numerous types of data that exist and observe where they can be found in everyday life. You will delve into basic Python functionality, along with an introduction to Jupyter Notebook. All of the course information on grading, prerequisites, and expectations are on the course syllabus and you can find more information on our Course Resources page."
36,WEEK 2 - UNIVARIATE DATA,4,https://www.coursera.org/learn/understanding-visualization-data,"In the second week of this course, we will be looking at graphical and numerical interpretations for one variable (univariate data). In particular, we will be creating and analyzing histograms, box plots, and numerical summaries of our data in order to give a basis of analysis for quantitative data and bar charts and pie charts for categorical data. A few key interpretations will be made about our numerical summaries such as mean, IQR, and standard deviation. An assessment is included at the end of the week concerning numerical summaries and interpretations of these summaries."
37,WEEK 3 - MULTIVARIATE DATA,4,https://www.coursera.org/learn/understanding-visualization-data,"In the third week of this course on looking at data, we’ll introduce key ideas for examining research questions that require looking at more than one variable.  In particular, we will consider both numerically and visually how different variables interact, how summaries can appear deceiving if you don’t properly account for interactions, and differences between quantitative and categorical variables.  This week’s assignment will consist of a writing assignment along with reviewing those of your peers."
38,WEEK 4 - POPULATIONS AND SAMPLES,4,https://www.coursera.org/learn/understanding-visualization-data,"In this week, you’ll spend more time thinking about where data come from. The highest-quality statistical analyses of data will always incorporate information about the process used to generate the data, or features of the data collection design. You’ll be exposed to important concepts related to sampling from larger populations, including probability and non-probability sampling, and how we can make inferences about larger populations based on well-designed samples. You’ll also learn about the concept of a sampling distribution, and how estimation of the variance of that distribution plays a critical role in making statements about populations. Finally, you’ll learn about the importance of reading the documentation for a given data set; a key step in looking at data is also looking at the available documentation for that data set, which describes how the data were generated."
39,WEEK 1 - OVERVIEW & INFERENCE PROCEDURES,4,https://www.coursera.org/learn/inferential-statistical-analysis-python,"In this first week, we’ll review the course syllabus and discover the various concepts and objectives to be mastered in weeks to come. You’ll be introduced to inference methods and some of the research questions we’ll discuss in the course, as well as an overall framework for making decisions using data, considerations for how you make those decisions, and evaluating errors that you may have made.On the Python side, we’ll review some high level concepts from the first course in this series, Python’s statistics landscape, and walk through intermediate level Python concepts. All of the course information on grading, prerequisites, and expectations are on the course syllabus and you can find more information on our Course Resources page."
40,WEEK 2 - CONFIDENCE INTERVALS,4,https://www.coursera.org/learn/inferential-statistical-analysis-python,"In this second week, we will learn about estimating population parameters via confidence intervals. You will be introduced to five different types of population parameters, assumptions needed to calculate a confidence interval for each of these five parameters, and how to calculate confidence intervals. Quizzes  will appear throughout the week to test your understanding. In addition, you’ll learn how to create confidence intervals in Python."
41,WEEK 3 - HYPOTHESIS TESTING,4,https://www.coursera.org/learn/inferential-statistical-analysis-python,"In week three, we’ll learn how to test various hypotheses - using the five different analysis methods covered in the previous week. We’ll discuss the importance of various factors and assumptions with hypothesis testing and learn to interpret our results. We will also review how to distinguish which procedure is appropriate for the research question at hand.  Quizzes and a peer assessment will appear throughout the week to test your understanding."
42,WEEK 4 - LEARNER APPLICATION,4,https://www.coursera.org/learn/inferential-statistical-analysis-python,"In the final week of this course, we will walk through several examples and case studies that illustrate applications of the inferential procedures discussed in prior weeks. Learners will see examples of well-formulated research questions related to the study designs and data sets that we have discussed thus far, and via both confidence interval estimation and formal hypothesis testing, we will formulate inferential responses to those questions."
43,WEEK 1 - OVERVIEW & CONSIDERATIONS FOR STATISTICAL MODELING,4,https://www.coursera.org/learn/fitting-statistical-models-data-python,"We begin this third course of the Statistics with Python specialization with an overview of what is meant by “fitting statistical models to data.” In this first week, we will introduce key model fitting concepts, including the distinction between dependent and independent variables, how to account for study designs when fitting models, assessing the quality of model fit, exploring how different types of variables are handled in statistical modeling, and clearly defining the objectives of fitting models."
44,WEEK 2 - FITTING MODELS TO INDEPENDENT DATA,4,https://www.coursera.org/learn/fitting-statistical-models-data-python,"In this second week, we’ll introduce you to the basics of two types of regression: linear regression and logistic regression.  You’ll get the chance to think about how to fit models, how to assess how well those models fit, and to consider how to interpret those models in the context of the data.  You’ll also learn how to implement those models within Python."
45,WEEK 3 - FITTING MODELS TO DEPENDENT DATA,4,https://www.coursera.org/learn/fitting-statistical-models-data-python,"In the third week of this course, we will be building upon the modeling concepts discussed in Week 2. Multilevel and marginal models will be our main topic of discussion, as these models enable researchers to account for dependencies in variables of interest introduced by study designs. We’ll be covering why and when we fit these alternative models, likelihood ratio tests, as well as fixed effects and their interpretations. "
46,WEEK 4: Special Topics,4,https://www.coursera.org/learn/fitting-statistical-models-data-python,"In this final week, we introduce special topics that extend the curriculum from previous weeks and courses further. We will cover a broad range of topics such as various types of dependent variables, exploring sampling methods and whether or not to use survey weights when fitting models, and in-depth case studies utilizing Bayesian techniques to derive insights from data. You’ll also have the opportunity to apply Bayesian techniques in Python."
47,Before we get started...,9,https://www.coursera.org/learn/quantitative-methods?specialization=social-science,"In this first module we'll consider the basic principles of the scientific method, its history and its philosophies. But before we start talking methods, I'll give you a broad sense of what the course is about and how it's organized. Are you new to Coursera or still deciding whether this is the course for you? Then make sure to check out the 'Introduction' and 'What to expect' section below, so you'll have the essential information you need to decide and to do well in this course! If you have any questions about the course format, deadlines or grading, you'll probably find the answers here. Are you a Coursera veteran and anxious to get started? Then you might want to skip ahead to the first course topic: the Origins of the Scientific Method. You can always check the general information later. Veterans and newbies alike: Don't forget to introduce yourself in the 'meet and greet' forum!"
